1973,The Holy Mountain,Alejandro Jodorowsky,NULL,NULL,0,NULL,0,NULL
1985,Rendez-vous,André Téchiné,"André Téchiné, Olivier Assayas","Juliette Binoche, Wadeck Stanczak",0,NULL,0,NULL
2020,Passage,Ann Oren,NULL,NULL,0,NULL,0,NULL
1984,Next of Kin,Atom Egoyan,Atom Egoyan,Arsinée Khanjian,0,NULL,0,NULL
1987,Family Viewing,Atom Egoyan,Atom Egoyan,"David Hemblen, Gabrielle Rose, Arsinée Khanjian",0,NULL,0,NULL
1989,Speaking Parts,Atom Egoyan,Atom Egoyan,"Michael McManus, Arsinée Khanjian",0,NULL,0,NULL
1992,The Adjuster,Atom Egoyan,Atom Egoyan,"Elias Koteas, Arsinée Khanjian, Maury Chaykin, Gabrielle Rose",0,NULL,0,NULL
1993,Calendar,Atom Egoyan,Atom Egoyan,"Arsinée Khanjian, Atom Egoyan",0,NULL,0,NULL
1994,Exotica,Atom Egoyan,Atom Egoyan,"Bruce Greenwood, Mia Kirshner, Arsinée Khanjian",0,NULL,0,NULL
2002,Ararat,Atom Egoyan,Atom Egoyan,"Arsinée Khanjian, David Alpay",0,NULL,0,NULL
1971,Wanda,Barbara Loden,NULL,NULL,0,NULL,0,NULL
2018,Long Day’s Journey into Night,Bi Gan [毕赣],NULL,NULL,0,地球最後的夜晚,0,NULL
2001,Fat Girl,Catherine Breillat,Catherine Breillat,"Anaïs Reboux, Arsinée Khanjian",0,À ma soeur!,0,NULL
2010,White Material,Claire Denis,"Claire Denis, Marie N’Diaye",Isabelle Huppert,0,NULL,0,NULL
2007,Water Lilies,Céline Sciamma,NULL,NULL,0,NULL,0,NULL
1985,Taipei Story,Edward Yang [楊德昌],NULL,NULL,0,青梅竹馬,0,NULL
1971,A New Leaf,Elaine May,NULL,NULL,0,NULL,0,NULL
1976,Mikey and Nicky,Elaine May,NULL,NULL,0,NULL,0,NULL
1951,"Presentation, or Charlotte and Her Steak",Éric Rohmer,NULL,"Jean-Luc Godard, Stéphane Audran, Anna Karina",0,Présentation ou Charlotte et son steak,1,NULL
1966,A Modern Coed,Éric Rohmer,NULL,NULL,0,NULL,1,NULL
1972,Love in the Afternoon,Éric Rohmer,Éric Rohmer,"Bernard Verley, Zouzou",0,"L’amour, l’après-midi",0,NULL
1963,8½,Federico Fellini,NULL,NULL,1,NULL,0,NULL
1924,Ballet mécanique,"Fernand Léger, Dudley Murphy",NULL,NULL,0,NULL,1,NULL
1962,David and Lisa,Frank Perry,"Theodore Isaac Rubin M.D. (book), Eleanor Perry","Keir Dullea, Janet Margolin",0,NULL,0,NULL
1970,Bed and Board,François Truffaut,"François Truffaut, Claude de Givray, Bernard Revon","Jean-Pierre Léaud, Claude Jade, Hiroko Berghauer",0,Domicile conjugal,0,NULL
1979,Love on the Run,François Truffaut,"François Truffaut, Marie-France Pisier, Jean Aurel, Suzanne Schiffman","Jean-Pierre Léaud, Marie-France Pisier, Claude Jade",0,L’amour en fuite,0,NULL
2021,Code Name: Nagasaki,Fredrik S. Hana,NULL,NULL,0,NULL,0,NULL
1992,The Living End,Gregg Araki,Gregg Araki,"Mike Dytri, Craig Gilmore",0,NULL,0,NULL
1992,Midori,Hiroshi Harada [原田 博志],"Suehiro Maruo [丸尾 末広] (manga), Hiroshi Harada [原田 博志]",NULL,0,地下幻燈劇画 少女椿,0,NULL
1964,Woman in the Dunes,Hiroshi Teshigahara [勅使河原 宏],"Kōbō Abe [安部 公房] (novel), Eiko Yoshida","Eiji Okada [岡田 英次], Kyōko Kishida [岸田 今日子]",0,砂の女,0,NULL
1966,The Face of Another,Hiroshi Teshigahara [勅使河原 宏],Kōbō Abe [安部 公房] (novel),Tatsuya Nakadai [仲代 達矢],0,他人の顔,0,NULL
1938,Bringing up Baby,Howard Hawks,"Dudley Nichols, Hagar Wilde","Katharine Hepburn, Cary Grant",0,NULL,0,NULL
2018,An Elephant Sitting Still,Hu Bo [胡遷],NULL,NULL,0,大象席地而坐,0,NULL
1971,The Touch,Ingmar Bergman,Ingmar Bergman,"Elliott Gould, Bibi Andersson",0,NULL,0,NULL
1979,The China Syndrome,James Bridges,"Mike Gray, T.S. Cook, James Bridges",Jane Fonda,0,NULL,0,NULL
1967,Le samouraï,Jean-Pierre Melville,"Jean-Pierre Melville, Georges Pellegrin",Alain Delon,0,NULL,0,NULL
1932,Shanghai Express,Josef von Sternberg,NULL,NULL,0,NULL,0,NULL
1957,Sayonara,Joshua Logan,NULL,NULL,0,NULL,0,NULL
2005,Tony Takitani,Jun Ichikawa [市川 準],"Haruki Murakami [村上 春樹] (short story), Jun Ichikawa [市川 準]","Issei Ogata [イッセー 尾形], Rie Miyazawa [宮沢 りえ]",0,NULL,0,NULL
1985,Tampopo,Jūzō Itami [伊丹 十三],Jūzō Itami [伊丹 十三],Nobuko Miyamoto [宮本 信子],0,タンポポ,0,NULL
1992,Damage,Louis Malle,"Josephine Hart (novel), David Hare","Jeremy Irons, Juliette Binoche",0,NULL,0,NULL
1929,An Andalusian Dog,Luis Buñuel,NULL,NULL,0,NULL,1,NULL
1967,Belle de Jour,Luis Buñuel,"Joseph Kessel (novel), Luis Buñuel, Jean-Claude Carrière",Catherine Deneuve,0,NULL,0,NULL
1974,The Phantom of Liberty,Luis Buñuel,"Luis Buñuel, Jean-Claude Carrière",Jean-Claude Brialy,0,NULL,0,NULL
1977,That Obscure Object of Desire,Luis Buñuel,"Luis Buñuel, Jean-Claude Carrière","Fernando Rey, Carole Bouquet, Ángela Molina",0,Cet obscur objet du désir,0,NULL
1967,The Big Shave,Martin Scorsese,NULL,NULL,0,NULL,1,NULL
1957,Black River,Masaki Kobayashi [小林 正樹],"Takeo Tomishima [富島 健夫] (story), Zenzō Matsuyama [松山 善三]","Fumio Watanabe [渡辺 文雄], Tatsuya Nakadai [仲代 達矢], Ineko Arima [有馬 稲子]",0,黒い河,0,NULL
1997,Funny Games,Michael Haneke,Michael Haneke,NULL,0,NULL,0,NULL
2000,Code Unknown,Michael Haneke,Michael Haneke,Juliette Binoche,0,Code inconnu,0,NULL
2001,The Piano Teacher,Michael Haneke,"Elfriede Jelinek (novel), Michael Haneke",Isabelle Huppert,0,La pianiste,0,NULL
2005,Caché,Michael Haneke,Michael Haneke,Juliette Binoche,0,NULL,0,NULL
1960,Cruel Story of Youth,Nagisa Ōshima [大島 渚],NULL,NULL,0,青春残酷物語,0,NULL
1976,In the Realm of the Senses,Nagisa Ōshima [大島 渚],NULL,NULL,0,愛のコリーダ,0,NULL
1980,Bad Timing,Nicolas Roeg,NULL,NULL,0,NULL,0,NULL
2010,Tord and Tord,Niki Lindroth von Bahr,NULL,NULL,0,NULL,1,NULL
2014,Bath House,Niki Lindroth von Bahr,NULL,NULL,0,NULL,1,NULL
2017,The Burden,Niki Lindroth von Bahr,NULL,NULL,0,NULL,1,NULL
1983,The Great Sadness of Zohara,Nina Menkes,NULL,Tinka Menkes,0,NULL,1,NULL
1991,Queen of Diamonds,Nina Menkes,Nina Menkes,Tinka Menkes,0,NULL,0,NULL
2007,Phantom Love,Nina Menkes,Nina Menkes,Marina Shoif,0,NULL,0,NULL
2010,Dissolution,Nina Menkes,Nina Menkes,Slava Bibergal,0,NULL,0,NULL
1977,House,Nobuhiko Ōbayashi [大林 宣彦],NULL,NULL,0,NULL,0,NULL
1996,The Pillow Book,Peter Greenaway,NULL,NULL,0,NULL,0,NULL
1988,The Unbearable Lightness of Being,Philip Kaufman,"Milan Kundera (novel), Jean-Claude Carrière, Philip Kaufman","Daniel Day-Lewis, Juliette Binoche, Lena Olin",0,NULL,0,NULL
1975,"Salò, or the 120 Days of Sodom",Pier Paolo Pasolini,NULL,NULL,0,NULL,0,NULL
1966,As Long as You’ve Got Your Health,Pierre Étaix,"Pierre Étaix, Jean-Claude Carrière",Pierre Étaix,0,Tant qu'on a la santé,1,NULL
1962,Happy Anniversary,"Pierre Étaix, Jean-Claude Carrière","Pierre Étaix, Jean-Claude Carrière",NULL,0,Heureux anniversaire,1,NULL
1960,Purple Noon,René Clément,"Patricia Highsmith (novel), René Clément, Paul Gégauff","Alain Delon, Marie Laforêt, Maurice Ronet",0,Plein soleil,0,NULL
1993,Dazed and Confused,Richard Linklater,Richard Linklater,"Jason London, Milla Jovovich, Anthony Rapp, Wiley Wiggins, Christin Hinojosa",0,NULL,0,Orotund 
1992,The Player,Robert Altman,Michael Tolkin,"Tim Robbins, Greta Scacchi",0,NULL,0,NULL
1967,Mouchette,Robert Bresson,NULL,NULL,0,NULL,0,NULL
1983,L’Argent,Robert Bresson,NULL,NULL,0,NULL,0,NULL
1974,Chinatown,Roman Polanski,NULL,NULL,0,NULL,0,NULL
1963,Shock Corridor,Samuel Fuller,NULL,NULL,0,NULL,0,NULL
1963,Youth of the Beast,Seijun Suzuki [鈴木 清順],NULL,Joe Shishido [宍戸 錠],0,野獣の青春,0,NULL
1967,Branded to Kill,Seijun Suzuki [鈴木 清順],NULL,Joe Shishido [宍戸 錠],0,殺しの烙印,0,NULL
1974,Pastoral: To Die in the Country,Shūji Terayama [寺山 修司],NULL,NULL,0,田園に死す,0,NULL
2021,No Trance,Simon Lavoie,NULL,NULL,0,NULL,0,NULL
1999,The Virgin Suicides,Sofia Coppola,NULL,NULL,0,NULL,0,NULL
1971,A Clockwork Orange,Stanley Kubrick,"Anthony Burgess (novel), Stanley Kubrick",Malcolm McDowell,0,NULL,0,NULL
1995,Sabrina,Sydney Pollack,NULL,"Harrison Ford, Julia Ormond",0,NULL,0,NULL
1967,A Colt Is My Passport,Takashi Nomura [野村 孝],NULL,Joe Shishido [宍戸 錠],0,拳銃は俺のパスポート,0,NULL
1973,Badlands,Terrence Malick,NULL,NULL,0,NULL,0,NULL
1973,Lady Snowblood,Toshiya Fujita [藤田 敏八],NULL,Meiko Kaji [梶 芽衣子],0,修羅雪姫,0,NULL
2008,Home,Ursula Meier,"Ursula Meier, Antoine Jaccoud",Isabelle Huppert,0,NULL,0,NULL
1980,Cruising,William Friedkin,NULL,NULL,0,NULL,0,NULL
1995,Fallen Angels,Wong Kar-wai [王家衛],Wong Kar-Wai [王家衛],NULL,0,墮落天使,0,NULL
1977,Annie Hall,Woody Allen,"Woody Allen, Marshall Brickman","Woody Allen, Diane Keaton",0,NULL,0,NULL
1995,La cérémonie,Claude Chabrol,"Ruth Rendell (novel), Claude Chabrol, Caroline Eliacheff","Sandrine Bonnaire, Isabelle Huppert, Virginie Ledoyen",0,NULL,0,NULL
1962,Lolita,Stanley Kubrick,Vladimir Nabokov,"James Mason, Sue Lyon",0,NULL,0,NULL
1990,Metropolitan,Whit Stillman,Whit Stillman,"Carolyn Farina, Chris Eigeman, Taylor Nichols",0,NULL,0,Roman Shaded D
1975,Four Women,Julie Dash,NULL,Linda Martina Young,0,NULL,1,NULL
2004,Influenza,Bong Joon Ho [奉俊昊],NULL,NULL,0,NULL,1,NULL
1965,With Beauty and Sorrow,Masahiro Shinoda [篠田 正浩],"Yasunari Kawabata [川端 康成] (novel), Nobuo Yamada [山田 信夫]","Kaoru Yachigusa [八千草 薫], Mariko Kaga [加賀 まりこ]",0,美しさと哀しみ,0,NULL
1991,Heat Wave,Hideo Gosha [五社 英雄],Kōji Takada [高田 宏治],"Kanako Higuchi [樋口 可南子], Tatsuya Nakadai [仲代 達矢]",0,陽炎,0,NULL
1998,Lick the Star,Sofia Coppola,"Stephanie Hayman, Sofia Coppola",Christina Turley,0,NULL,1,NULL
2000,Dancer in the Dark,Lars von Trier,Lars von Trier,"Björk, Catherine Deneuve",0,NULL,0,NULL
1967,La collectionneuse,Éric Rohmer,"Patrick Bauchau, Haydée Politoff, Daniel Pommereulle, Éric Rohmer","Patrick Bauchau, Haydée Politoff",0,NULL,0,NULL
1959,Hiroshima mon amour,Alain Resnais,Marguerite Duras,"Emmanuelle Riva, Eiji Okada [岡田 英次]",0,NULL,0,NULL
1965,Pleasures of the Flesh,Nagisa Ōshima [大島 渚],"Nagisa Ōshima [大島 渚], Fūtarō Yamada [山田 風太郎] ","Katsuo Nakamura [中村 嘉葎雄], Mariko Kaga [加賀 まりこ]",0,悦楽,0,NULL
1972,The Discreet Charm of the Bourgeoisie,Luis Buñuel,"Luis Buñuel, Jean-Claude Carrière","Fernando Rey, Bulle Ogier, Milena Vukotic",0,Le charme discret de la bourgeoisie,1,Cooper Black Italic
1980,A Week’s Vacation,Bertrand Tavernier,"Marie-Françoise Hans, Bertrand Tavernier, Colo Tavernier","Nathalie Baye, Flore Fitzgerald",0,Une semaine de vacances,0,Windsor UltraHeavy
1984,A Sunday in the Country,Bertrand Tavernier,"Pierre Bost (novel), Bertrand Tavernier, Colo Tavernier","Sabine Azéma, Michel Aumont",0,Un dimanche à la campagne,0,Bookman Demi Bold Italic
1980,Every Man for Himself,Jean-Luc Godard,"Anne-Marie Miéville, Jean-Claude Carrière","Isabelle Huppert, Jacques Dutronc, Nathalie Baye",0,Sauve qui peut (la vie),0,NULL
1986,Betty Blue,Jean-Jacques Beineix,"Philippe Djian (novel), Jean-Jacques Beineix","Jean-Hugues Anglade, Béatrice Dalle",0,37°2 le matin,0,Optima
1988,Jane B. par Agnès V.,Agnès Varda,Agnès Varda,Jane Birkin,0,NULL,0,ITC Benguiat Condensed Medium
1966,Blow-Up,Michelangelo Antonioni,"Michelangelo Antonioni (story), Julio Cortázar (story), Tonino Guerra, Edward Bond","David Hemmings, Vanessa Redgrave",0,NULL,0,NULL
1994,Barcelona,Whit Stillman,Whit Stillman,"Taylor Nichols, Chris Eigeman, Tushka Bergen",0,NULL,0,"Arnold Boecklin, Centaur"
1998,The Last Days of Disco,Whit Stillman,Whit Stillman,"Chloë Sevigny, Kate Beckinsale, Chris Eigeman, Mackenzie Astin",0,NULL,0,Sackers Gothic
1995,Kicking and Screaming,Noah Baumbach,"Noah Baumbach (story), Bo Berkman (story)","Josh Hamilton, Chris Eigeman",0,NULL,0,NULL
1965,Alphaville,Jean-Luc Godard,"Jean-Luc Godard, Paul Éluard (poem)","Eddie Constantine, Anna Karina",0,"Alphaville, une étrange aventure de Lemmy Caution",0,NULL
1961,A Woman Is a Woman,Jean-Luc Godard,"Geneviève Cluny, Jean-Luc Godard","Jean-Claude Brialy, Anna Karina",0,Une femme est une femme,0,NULL
1994,Cold Water,Olivier Assayas,Olivier Assayas,"Virginie Ledoyen, Cyprien Fouquet",0,L’eau froide,0,Dom Casual
1989,"Sex, Lies, and Videotape",Steven Soderbergh,Steven Soderbergh,"James Spader, Andie MacDowell, Laura San Giacomo",0,NULL,0,NULL
1991,Night on Earth,Jim Jarmusch,Jim Jarmusch,"Winona Ryder, Giancarlo Esposito, Béatrice Dalle, Roberto Benigni, Matti Pellonpää",0,NULL,0,Elektrix (modified)
1984,Streetwise,Martin Bell,Cheryl McCall,NULL,0,NULL,0,NULL
1984,Blood Simple,"Joel Coen, Ethan Coen","Joel Coen, Ethan Coen","John Getz, Frances McDormand",0,NULL,0,Goudy Oldstyle ExtraBold
2001,Y tu mamá también,Alfonso Cuarón,"Carlos Cuarón, Alfonso Cuarón","Ana López Mercado, Diego Luna, Gael García Bernal",0,NULL,0,Swiss 911 Std Extra Compressed
1983,Sans soleil,Chris Marker,Chris Marker,NULL,0,NULL,0,Annlie Extra Bold
1986,The Terrorizers,Edward Yang [楊德昌],"Hsiao-Yeh [小野], Edward Yang [楊德昌]","Cora Miao [繆騫人], Li-Chun Lee",0,NULL,0,NULL
1962,Antoine et Colette,François Truffaut,François Truffaut,"Jean-Pierre Léaud, Marie-France Pisier",0,NULL,1,NULL
2000,O Fantasma,João Pedro Rodrigues,"João Pedro Rodrigues, José Neves, Paulo Rebelo, Alexandre Melo","Ricardo Meneses, Beatriz Torcato",0,NULL,0,NULL
1987,The Dead Tree,Joseph Morder,"Philippe Fano, Joseph Morder, Marie Serrurier","Philippe Fano, Marie Serrurier, Rosette",0,L’arbre mort,0,Century Bold
